{
  "$schema": "../schema/pib.schema.json",
  "id": "pib-2025",
  "title": "Produsul intern brut, România și cele 42 de județe, 2015–2025",
  "publisher": "Eurostat",
  "counties": [
    "AB",
    "AG",
    "AR",
    "B",
    "BC",
    "BH",
    "BN",
    "BR",
    "BT",
    "BV",
    "BZ",
    "CJ",
    "CL",
    "CS",
    "CT",
    "CV",
    "DB",
    "DJ",
    "GJ",
    "GL",
    "GR",
    "HD",
    "HR",
    "IF",
    "IL",
    "IS",
    "MH",
    "MM",
    "MS",
    "NT",
    "OT",
    "PH",
    "SB",
    "SJ",
    "SM",
    "SV",
    "TL",
    "TM",
    "TR",
    "VL",
    "VN",
    "VS"
  ],
  "period": "2015-2025",
  "currency": "RON",
  "provenance": {
    "source": "eurostat-nama_10_gdp",
    "locator": "nama_10_gdp, B1GQ, unitățile CP_MNAC și CP_MEUR, geo=RO, anii 2015–2025; pe județe din nama_10r_3gdp, unitățile MIO_NAC și MIO_EUR, cele 42 regiuni NUTS 3 ale României",
    "confidence": "verbatim",
    "note": "Sumele sunt preluate ca atare, în milioane, în unitatea în care le publică Eurostat. Nu se calculează nimic aici: raportul dintre impozit și PIB se face în pagină, pe anul ales de cititor."
  },
  "assumptions": {
    "fromYear": 2015,
    "nationalLatestYear": 2025,
    "countyLatestYear": 2024,
    "note": "PIB-ul județean se publică cu un an întârziere față de cel național, deci ultimul an nu este același în cele două serii."
  },
  "summary": {
    "years": 11,
    "counties": 42
  },
  "series": [
    {
      "year": 2015,
      "gdpMron": 712548.6,
      "gdpMeur": 160289.0
    },
    {
      "year": 2016,
      "gdpMron": 752129.1,
      "gdpMeur": 167497.1
    },
    {
      "year": 2017,
      "gdpMron": 851620.6,
      "gdpMeur": 186399.2
    },
    {
      "year": 2018,
      "gdpMron": 953049.2,
      "gdpMeur": 204780.7
    },
    {
      "year": 2019,
      "gdpMron": 1059822.1,
      "gdpMeur": 223341.4
    },
    {
      "year": 2020,
      "gdpMron": 1063650.7,
      "gdpMeur": 219839.8
    },
    {
      "year": 2021,
      "gdpMron": 1186015.4,
      "gdpMeur": 240986.6
    },
    {
      "year": 2022,
      "gdpMron": 1384597.8,
      "gdpMeur": 280777.4
    },
    {
      "year": 2023,
      "gdpMron": 1590749.4,
      "gdpMeur": 321577.9
    },
    {
      "year": 2024,
      "gdpMron": 1759183.3,
      "gdpMeur": 353633.1
    },
    {
      "year": 2025,
      "gdpMron": 1916404.9,
      "gdpMeur": 380058.1
    }
  ],
  "regions": [
    {
      "county": "AB",
      "nuts3": "RO121",
      "name": "Alba",
      "series": [
        {
          "year": 2015,
          "gdpMron": 11800.6,
          "gdpMeur": 2654.6
        },
        {
          "year": 2016,
          "gdpMron": 12437.4,
          "gdpMeur": 2769.8
        },
        {
          "year": 2017,
          "gdpMron": 14433.2,
          "gdpMeur": 3159.1
        },
        {
          "year": 2018,
          "gdpMron": 16354.6,
          "gdpMeur": 3514.1
        },
        {
          "year": 2019,
          "gdpMron": 17459.9,
          "gdpMeur": 3679.4
        },
        {
          "year": 2020,
          "gdpMron": 17500.7,
          "gdpMeur": 3617.1
        },
        {
          "year": 2021,
          "gdpMron": 20217.5,
          "gdpMeur": 4108.0
        },
        {
          "year": 2022,
          "gdpMron": 21257.0,
          "gdpMeur": 4310.6
        },
        {
          "year": 2023,
          "gdpMron": 24969.9,
          "gdpMeur": 5047.8
        },
        {
          "year": 2024,
          "gdpMron": 27233.4,
          "gdpMeur": 5474.5
        }
      ]
    },
    {
      "county": "AG",
      "nuts3": "RO311",
      "name": "Argeș",
      "series": [
        {
          "year": 2015,
          "gdpMron": 19467.4,
          "gdpMeur": 4379.2
        },
        {
          "year": 2016,
          "gdpMron": 20487.8,
          "gdpMeur": 4562.6
        },
        {
          "year": 2017,
          "gdpMron": 23918.0,
          "gdpMeur": 5235.1
        },
        {
          "year": 2018,
          "gdpMron": 26577.6,
          "gdpMeur": 5710.7
        },
        {
          "year": 2019,
          "gdpMron": 28805.5,
          "gdpMeur": 6070.3
        },
        {
          "year": 2020,
          "gdpMron": 28125.9,
          "gdpMeur": 5813.2
        },
        {
          "year": 2021,
          "gdpMron": 30145.2,
          "gdpMeur": 6125.2
        },
        {
          "year": 2022,
          "gdpMron": 34924.7,
          "gdpMeur": 7082.2
        },
        {
          "year": 2023,
          "gdpMron": 40484.0,
          "gdpMeur": 8184.0
        },
        {
          "year": 2024,
          "gdpMron": 44267.1,
          "gdpMeur": 8898.6
        }
      ]
    },
    {
      "county": "AR",
      "nuts3": "RO421",
      "name": "Arad",
      "series": [
        {
          "year": 2015,
          "gdpMron": 15481.1,
          "gdpMeur": 3482.5
        },
        {
          "year": 2016,
          "gdpMron": 16474.3,
          "gdpMeur": 3668.8
        },
        {
          "year": 2017,
          "gdpMron": 18756.4,
          "gdpMeur": 4105.3
        },
        {
          "year": 2018,
          "gdpMron": 20829.3,
          "gdpMeur": 4475.6
        },
        {
          "year": 2019,
          "gdpMron": 23091.2,
          "gdpMeur": 4866.1
        },
        {
          "year": 2020,
          "gdpMron": 21835.2,
          "gdpMeur": 4513.0
        },
        {
          "year": 2021,
          "gdpMron": 23188.3,
          "gdpMeur": 4711.6
        },
        {
          "year": 2022,
          "gdpMron": 26569.4,
          "gdpMeur": 5387.9
        },
        {
          "year": 2023,
          "gdpMron": 31123.1,
          "gdpMeur": 6291.7
        },
        {
          "year": 2024,
          "gdpMron": 33951.9,
          "gdpMeur": 6825.1
        }
      ]
    },
    {
      "county": "B",
      "nuts3": "RO321",
      "name": "București",
      "series": [
        {
          "year": 2015,
          "gdpMron": 176978.6,
          "gdpMeur": 39811.6
        },
        {
          "year": 2016,
          "gdpMron": 184053.3,
          "gdpMeur": 40988.2
        },
        {
          "year": 2017,
          "gdpMron": 207346.8,
          "gdpMeur": 45383.2
        },
        {
          "year": 2018,
          "gdpMron": 228745.5,
          "gdpMeur": 49150.3
        },
        {
          "year": 2019,
          "gdpMron": 262576.2,
          "gdpMeur": 55334.0
        },
        {
          "year": 2020,
          "gdpMron": 266047.5,
          "gdpMeur": 54987.8
        },
        {
          "year": 2021,
          "gdpMron": 299014.5,
          "gdpMeur": 60756.8
        },
        {
          "year": 2022,
          "gdpMron": 363449.4,
          "gdpMeur": 73702.6
        },
        {
          "year": 2023,
          "gdpMron": 416662.3,
          "gdpMeur": 84230.4
        },
        {
          "year": 2024,
          "gdpMron": 467626.2,
          "gdpMeur": 94002.8
        }
      ]
    },
    {
      "county": "BC",
      "nuts3": "RO211",
      "name": "Bacău",
      "series": [
        {
          "year": 2015,
          "gdpMron": 14074.1,
          "gdpMeur": 3166.0
        },
        {
          "year": 2016,
          "gdpMron": 14431.6,
          "gdpMeur": 3213.9
        },
        {
          "year": 2017,
          "gdpMron": 16046.3,
          "gdpMeur": 3512.2
        },
        {
          "year": 2018,
          "gdpMron": 18286.9,
          "gdpMeur": 3929.3
        },
        {
          "year": 2019,
          "gdpMron": 20593.3,
          "gdpMeur": 4339.7
        },
        {
          "year": 2020,
          "gdpMron": 21603.0,
          "gdpMeur": 4465
        },
        {
          "year": 2021,
          "gdpMron": 23024.5,
          "gdpMeur": 4678.3
        },
        {
          "year": 2022,
          "gdpMron": 26336.9,
          "gdpMeur": 5340.8
        },
        {
          "year": 2023,
          "gdpMron": 33252.7,
          "gdpMeur": 6722.2
        },
        {
          "year": 2024,
          "gdpMron": 36815.2,
          "gdpMeur": 7400.6
        }
      ]
    },
    {
      "county": "BH",
      "nuts3": "RO111",
      "name": "Bihor",
      "series": [
        {
          "year": 2015,
          "gdpMron": 16199.5,
          "gdpMeur": 3644.1
        },
        {
          "year": 2016,
          "gdpMron": 17215.7,
          "gdpMeur": 3833.9
        },
        {
          "year": 2017,
          "gdpMron": 19748.5,
          "gdpMeur": 4322.5
        },
        {
          "year": 2018,
          "gdpMron": 21938.8,
          "gdpMeur": 4714.0
        },
        {
          "year": 2019,
          "gdpMron": 24533.5,
          "gdpMeur": 5170.1
        },
        {
          "year": 2020,
          "gdpMron": 24801.8,
          "gdpMeur": 5126.1
        },
        {
          "year": 2021,
          "gdpMron": 27009.5,
          "gdpMeur": 5488.1
        },
        {
          "year": 2022,
          "gdpMron": 31653.8,
          "gdpMeur": 6419.0
        },
        {
          "year": 2023,
          "gdpMron": 37132.1,
          "gdpMeur": 7506.4
        },
        {
          "year": 2024,
          "gdpMron": 40848.1,
          "gdpMeur": 8211.3
        }
      ]
    },
    {
      "county": "BN",
      "nuts3": "RO112",
      "name": "Bistrița-Năsăud",
      "series": [
        {
          "year": 2015,
          "gdpMron": 7567.1,
          "gdpMeur": 1702.2
        },
        {
          "year": 2016,
          "gdpMron": 8057.4,
          "gdpMeur": 1794.4
        },
        {
          "year": 2017,
          "gdpMron": 8897.8,
          "gdpMeur": 1947.5
        },
        {
          "year": 2018,
          "gdpMron": 9772.1,
          "gdpMeur": 2099.7
        },
        {
          "year": 2019,
          "gdpMron": 10945.1,
          "gdpMeur": 2306.5
        },
        {
          "year": 2020,
          "gdpMron": 10885.2,
          "gdpMeur": 2249.8
        },
        {